id,profile_url,name,email,address,phone,whatsapp
806,https://nigeriapropertycentre.com/agents/pasgobel-integrated-services-13335,Pasgobel Integrated Services,pascalnj@yahoo.com,"40 Mushin Road, Isolo, Lagos, Nigeria","08066309624, 08188484294",2348066309624
807,https://nigeriapropertycentre.com/agents/abodes-lagos-72526,Abodes Lagos,,"Plot 11 Ibrahim Odofin, Lekki, Lagos, Nigeria",2348033867084,2348033867084
808,https://nigeriapropertycentre.com/agents/island-luxury-living-home-and-lifestyle-49504,Island Luxury Living Home And Lifestyle,islandluxuryliving@gmail.com,"1, Bishop Oluwaole Street,, Victoria Island, Lagos., Nigeria",8180783615,8180783615
809,https://nigeriapropertycentre.com/agents/andymoore-realty-30067,Andymoore Realty,nnamdi.oguebie@yahoo.com,"No 10 Teniola Street, Ijesha, Surulere, Lagos, Nigeria","08160591888, 08036960341, 08179280373, 08160591888",2348160591888
810,https://nigeriapropertycentre.com/agents/peniel-realtors-global-company-203731,Peniel Realtors Global Company,,"Adeyemo Alakija Street, Victoria Island, Lagos, Nigeria","08034717938, 08025440595",2348025440595
811,https://nigeriapropertycentre.com/agents/hudders-field-property-agency-25538,Hudders Field Property Agency,info@huddersfieldproperty.net,"7, Akilo Road, Cocoa Bus Stop, Ogba, Ikeja, Lagos, Nigeria","2348105017669, 2348095476053, 2348127762727",2318105017669
812,https://nigeriapropertycentre.com/agents/cava-palazzo-133747,Cava Palazzo,,"Brasas Place, 69 Asmiralty Way,, Lekki Phase 1, Lagos, Nigeria","08126818002, 08126818002",2348126818002
813,https://nigeriapropertycentre.com/agents/larrysng-homes-and-realtors-ltd-16649,Larrysng Homes And Realtors Ltd,larrysnghomes@gmail.com,"Suit H56/57, Ikota Shopping Complex, Vgc, Lekki, Lagos, Nigeria","08060759304, 08185333109",8060759304
814,https://nigeriapropertycentre.com/agents/mattimind-enterprises-16995,Mattimind Enterprises,lagatony@yahoo.com,"92 Aina Street, Opp. Grammar School Bus Stop, Ojodu, Lagos, Nigeria","08034403209, 08034403209, 08060455985",2349052819604
815,https://nigeriapropertycentre.com/agents/mausi-realty-3495,Mausi Realty,mauzi15@hotmail.com,"9 Ishaga Street, Ojodu Berger, Lagos, Nigeria","08023413642, 08063768619",2348063768619
816,https://nigeriapropertycentre.com/agents/gracespace-resource-and-development-ltd-116101,Gracespace Resource And Development Ltd,,"Hse@ Alasia B/stop Adj Liberty Bells School, Oke-ira, Null, Lekki - Ajah, Lagos, Nigeria",7080325008,2347080325008
817,https://nigeriapropertycentre.com/agents/enril-solutions-2256,Enril Solutions,enrilsolutions@gmail.com,"1, Victoria Street, Osolo Way, Off International Airport Road, Isolo, Lagos, Nigeria","07042611014, 08187098437",2347042611014
818,https://nigeriapropertycentre.com/agents/mcrich-consulting-limited-28801,Mcrich Consulting Limited,mcrichconsulting@gmail.com,"9 Olusesi Street, Cement, Lagos, Nigeria","08039426967, 08030412154",8039426967
819,https://nigeriapropertycentre.com/agents/tunmibi-properties-ventures-25920,Tunmibi Properties Ventures,,"66, Allen Avenue, By Ad Eboye Sholanke Street, Ikeja, Lagos, Nigeria","08123420222, 08099224777, 08033744462",2348099224777
820,https://nigeriapropertycentre.com/agents/opulence-realtors-and-services-limited-30054,Opulence Realtors And Services Limited,opulencerealtors1@gmail.com,"7, Agbedina Street, Isheri, Ikeja, Lagos, Nigeria","07033390347, 08035771142",7033390347
821,https://nigeriapropertycentre.com/agents/dexdom-contractors-81495,Dexdom Contractors,dennisnnamdi89@gmail.com,"1, Elijah Faith Drive, Off Mechanic Village, Isolo Way, Ajao Estate, Lagos, Nigeria","+2347083070371, +2348163228491",2347083070371
822,https://nigeriapropertycentre.com/agents/property-crews-limited-44288,Property Crews Limited,propertycrewltd@gmail.com,"No. 4 Babatope Bejide Street, Lekki Phase 1, Lekki, Lagos, Nigeria","08156645650, 08156646666",2348156645650
823,https://nigeriapropertycentre.com/agents/genvest-global-ltd-103871,Genvest Global Ltd,genvest.ng@gmail.com,"6a Kehinde Street Ogudu Ori Oke, Ogudu Gra, Lagos, Nigeria","08156861311, 08052182404",8156861311
824,https://nigeriapropertycentre.com/agents/xandies-place-97349,Xandies Place,,"10 Baale Street, Agungi, Lagos, Nigeria","09065495653, 07056029584",2349065495653
825,https://nigeriapropertycentre.com/agents/gui-integrated-concept-limited-28236,Gui Integrated Concept Limited,guiintegrated@gmail.com,"Block 1 Flat 1, Bright Star, Ojota, Lagos, Nigeria","08032222501, 09053660494",2348032222501
826,https://nigeriapropertycentre.com/agents/bafam-royal-castles-30742,Bafam Royal Castles,kayodemuhammed.km@gmail.com,"No 21, Boyle Street, Bentley Suite, Onikan, Lagos Island, Lagos State, Nigeria","+2348097085822, +2348021124722",2348097085822
827,https://nigeriapropertycentre.com/agents/emalf-global-investment-nig-ltd-13177,Emalf Global Investment Nig Ltd,emalfglobalinvestment@gmail.com,"House 51b. Good Homes Estate, Isheri Olofin, Lagos, Nigeria",8023217623,2348023217623
828,https://nigeriapropertycentre.com/agents/misa-nigeria-limited-103259,Misa (nigeria) Limited,,"46b Glover Road, Ikoyi, Lagos, Nigeria",80555025038,2348055025038
829,https://nigeriapropertycentre.com/agents/northpoint-realty-homes-limited-77677,Northpoint Realty Homes Limited,,"Plot 2, Baderinwa Alabi Street Ikate / Lekki, Eti Osa, Lagos State, Nigeria","08124579981, 09151003003, 09154003003, 09153003003",8124579981
830,https://nigeriapropertycentre.com/agents/jop-investments-nigeria-ltd-168124,Jop Investments Nigeria Ltd,,"3 Tanimola Street, Isolo, Lagos State, Nigeria",8145408366,2348145408366
831,https://nigeriapropertycentre.com/agents/kotoye-and-co-real-estate-ventures-7303,Kotoye And Co. Real Estate Ventures,kolly5000@yahoo.com,"290,borno Way, Alagomeji., Yaba, Lagos, Nigeria","07064428849, 08172252967",8172252967
832,https://nigeriapropertycentre.com/agents/kollywood-home-properties-1093,Kollywood Home Properties,kollywoodgroup@gmail.com,"62/64 Victoria Street Ojota, Kosofe, Lagos, Nigeria","08028271971, 08099760838",2348028271971
833,https://nigeriapropertycentre.com/agents/avitro-real-estate-projects-limited-42904,Avitro Real Estate & Projects Limited,avirep01@gmail.com,"45, Odunlami Street, Lagos Island, Lagos, Nigeria","08175981909, 08175981924, 08175981924, 08084096993",8175981909
834,https://nigeriapropertycentre.com/agents/shortletpro-ltd-34049,Shortletpro Ltd,,"35a, Chief Collins Uchidiuno Street, Lekki Phase 1, Lekki, Lagos, Nigeria",7030404163,2347030404163
835,https://nigeriapropertycentre.com/agents/rapid-results-realty-3850,Rapid Results Realty,info.rapidresultsrealty@gmail.com,"1 Soji Adepegba Close, Off Allen Avenue,, Ikeja, Lagos, Nigeria","08034417191, 09026523021, 07056189650, 08034417191",8034417191
836,https://nigeriapropertycentre.com/agents/superite-real-estate-africa-limited-26832,Superite Real Estate Africa Limited,contact@superiteafrica.com,"Plot 14a, Adewale Kolawole Crescent, Off Tf Kuboye Road, Lekki Phase 1, Lekki, Lagos, Nigeria","+2347051883525, +2348061252520, +2348139528208, +234702684446",2348139528208
837,https://nigeriapropertycentre.com/agents/phostine-realty-ltd-131484,Phostine Realty Ltd,phostinerealty@gmail.com,"Suite 191 Road 5, Ikota Shopping Complex, Lekki-ajah, Lagos, Nigeria","+2349125413168, +2348069041019, +2348162765496, +2347066400040",2348069041019
838,https://nigeriapropertycentre.com/agents/korp-properties-company-26334,Korp Properties Company,info@korpproperties.com,"7, Abiodun Alimi, Nnpc, Ejigbo, Lagos, Nigeria","08055726413, 08183567878, 07032695206",2348055726413
839,https://nigeriapropertycentre.com/agents/alart-properties-and-homes-117385,Alart Properties And Homes,,"11 Prince Adeshina Street, Cele Imedu, Awoyaya, Ibeju Lekki, Lagos, Nigeria",8070635455,2348070635455
840,https://nigeriapropertycentre.com/agents/malickville-realtors-3500,Malickville Realtors,malickville@yahoo.co.uk,"6, Gafari Balogun Street, Ogudu, Ojota, Lagos, Nigeria","08185728080, 08023145707, 08185728080, 08032128899",8023145707
841,https://nigeriapropertycentre.com/agents/roc-reality-limited-164477,Roc Reality Limited,uwakwe.rositer@gmail.com,"16, Kola Iya Omolere Street, Ogudu, Lagos, Nigeria","08034580374, 08140753565",8034580374
842,https://nigeriapropertycentre.com/agents/kam360-degrees-realty-24990,Kam360 Degrees Realty,info@kam360degrees.com,"H4d, Chestnut Walk, Oceanbay Estate, Lafiaji, Lekki, Lagos, Nigeria","09052778215, 08059625502",9052778215
843,https://nigeriapropertycentre.com/agents/lee-home-maker-enterprises-37019,Lee Home Maker Enterprises,,"Emmanuel 25, Lekki, Lagos, Nigeria","08033617552, 08085522959",2348033617552
844,https://nigeriapropertycentre.com/agents/foeros-property-limited-9582,Foeros Property Limited,olorogunernest@gmail.com,"Suite C 3 & 20 Queens Shopping Complex, Ajah, Lekki Peninsula, Lagos, Nigeria",2347085231498,2347085231498
845,https://nigeriapropertycentre.com/agents/realityhomes-property-ventures-97045,Realityhomes Property Ventures,,"No 10 Samuel Temitope Abu Street Harmony Estate Langbasa, Ajah, Lagos State, Nigeria",8030906082,8030906082
846,https://nigeriapropertycentre.com/agents/ft-outstanding-ventures-26794,Ft Outstanding Ventures,soneyedebo@gmail.com,"1 Anifowose Street, Somolu, Lagos, Nigeria","08027278045, +2348102030355",2348102030355
847,https://nigeriapropertycentre.com/agents/j22-homes-investment-ltd-66528,J22 Homes Investment Ltd,,"3/9 Olukoleosho Street,, Ikeja,, Lagos, Nigeria","08109202008, 07036435999",8109202008
848,https://nigeriapropertycentre.com/agents/glitz-gala-productions-132000,Glitz Gala Productions,glitzgalaproductions@gmail.com,"4 Engr Sikuade Street,okeira Nla, Addo Road Ajah, Lagos, Nigeria","09069009894, 09056371005",9069009894
849,https://nigeriapropertycentre.com/agents/property-sphere-a-subsidiary-of-the-sphere-worldwide-ventures-144553,Property Sphere (a Subsidiary Of The Sphere Worldwide Ventures),,"22, Olatoye Ogundana Street, Ajah, Lagos, Nigeria","09098885677, 09052680325",9052680325
850,https://nigeriapropertycentre.com/agents/sheristus-multipurpose-venture-30043,Sheristus Multipurpose Venture,sheristusmv@gmail.com,"20, Oke Awori Street, Off Makarious Street , Ajah, Lagos, Nigeria","+2347035936487, +2347035936487, +2347058649702",2347035936487
851,https://nigeriapropertycentre.com/agents/chapelton-intl-enterprises-24185,Chapelton Int'l Enterprises,,"13 Olubiyi Fayinto Street, Agege, Lagos, Nigeria","07032511885, 07032511885, 08025350003",2347032511885
852,https://nigeriapropertycentre.com/agents/kayandice-nigeria-ltd-25000,Kayandice Nigeria Ltd,kennedyemefiena@gmail.com,"Plot 3, Block 3, T Y Danjuma Street, Dideolu Estate, Victoria Island, Lagos, Nigeria","08026820114, 09082920052",2348026820114
853,https://nigeriapropertycentre.com/agents/lovaerxy-services-117947,Lovaerxy Services,,"Nehitta St 25 Fl 7, Ibeju, Lagos, Nigeria","09057362222, 09057362222, 09042789489, 08164708808",2349057362222
854,https://nigeriapropertycentre.com/agents/wellpro-development-29002,Wellpro Development,,"2 Akin Osiyemi Street, Off Allen Avenue, Ikeja, Lagos, Nigeria","+2348185520099, +2348170999777, 08023972406, 08185570099",2348185520099
855,https://nigeriapropertycentre.com/agents/grozy-concepts-34334,G.rozy Concepts,ikogwe.rose@grozyconcepts.com,"11/17 Otunba Sobowale Way, Gbagada, Lagos, Nigeria",8069672199,2348069672199
856,https://nigeriapropertycentre.com/agents/leeward-properties-15520,Leeward Properties,leewardproperty@yahoo.com,"26, Mobolaji Bank-anthony Way, Ikeja, Lagos, Nigeria","+2348022990214, +2348065305104",2348065305104
857,https://nigeriapropertycentre.com/agents/angalla-limited-192348,Angalla Limited,,"F284a, Road 38, Vgc, Lekki, Lagos, Nigeria",8081620547,8081620547
858,https://nigeriapropertycentre.com/agents/buymax-realty-and-services-97363,Buymax Realty And Services,buymaxrealtors@gmail.com,"14,university Road, Onike, Yaba, Lagos, Nigeria","08164981665, 08164981665, 08164981665, 08164981665",2349157526774
859,https://nigeriapropertycentre.com/agents/servada-universal-services-11434,Servada Universal Services,lakeolatimehin@gmail.com,"7 James Ekhuru Street, Area One Estate, Adura Bus Stop, Alimosho, Lagos, Nigeria","08142875688, 08142875688",2348142875688
860,https://nigeriapropertycentre.com/agents/platinumplus-integrated-concepts-43805,Platinumplus Integrated Concepts,,"10, Bolaji Taylor Street, College Road, Ogba, Lagos, Nigeria","+2347062027292, +2347062027292",2347062027292
861,https://nigeriapropertycentre.com/agents/rehovot-properties-limited-156605,Rehovot Properties Limited,,"13 Bashorun, Abijo, Ajah, Lagos, Nigeria","09090000496, 07031885699",2349033133412
862,https://nigeriapropertycentre.com/agents/okwis-oil-and-gas-services-limited-179031,Okwis Oil And Gas Services Limited,,"Oribanwa Ph 2 M.k.o Rd,elemoro,number 11, Ibeju Lekki, Lagos, Nigeria","08038090943, 08137973283",8038090943
863,https://nigeriapropertycentre.com/agents/qualassets-business-solution-76051,Qualassets Business Solution,info@qualassets.com,"5, Araromi Oke Odu Close, Doyin, Lagos, Nigeria","08140477878, 08167710007",2348140477878
864,https://nigeriapropertycentre.com/agents/truslove-global-project-limited-187683,Truslove Global Project Limited,opeyemi.alogba@yahoo.com,"1ikot Ekan Street , Off Olayinka Jimbo, Ipakodo Ikorodu, Lagos, Nigeria","07026257268, 07026257268",2347026257268
865,https://nigeriapropertycentre.com/agents/jupiter-source-solutions-ltd-17063,Jupiter Source Solutions Ltd,jupitersourcesolutionsltd@hotmail.com,"59, Ogudu Gra Road, Ojota, Lagos, Nigeria","08183031299, 08183031299, 08023636020",2348023636020
866,https://nigeriapropertycentre.com/agents/davur-hills-properties-26656,Davur Hills Properties,davurhillsproperties@gmail.com,"Close 73, House 1a, Satellite Town, Lagos, Nigeria",8039651035,8039651035
867,https://nigeriapropertycentre.com/agents/moa-realtors-limited-30774,Moa Realtors Limited,info@moarealtors.com.ng,"Suite H-273, Road 3, Ikota Shopping Complex, Vgc, Lagos, Nigeria","08056385290, 08026747652",2348026747652
868,https://nigeriapropertycentre.com/agents/aryana-creations-34762,Aryana Creations,,"Suite 13, Hanola's Place, 25 Montgomery Road, Onike, Yaba, Lagos, Nigeria","08108640177, 08108640177",2348108640177
869,https://nigeriapropertycentre.com/agents/clayboard-nigeria-limited-36215,Clayboard Nigeria Limited,,"48, Bale Street, Agungi, Lekki, Lagos, Nigeria",2349031533553,2349031533553
870,https://nigeriapropertycentre.com/agents/abiolyn-success-ventures-co-34930,Abiolyn Success Ventures & Co,woleola@hotmail.com,"6, Adeyemi Street, Opposite Oba Palace, Ikosi, Ketu, Lagos State, Nigeria","08068750338, 08057345604, 08084107781, 09086213644",2348068750338
871,https://nigeriapropertycentre.com/agents/rockhill-properties-57467,Rockhill Properties,rockhillpropertiesltd@gmail.com,"Block 10, Plot 15, Olanireti Fasan Street Magodo Phase 1, Lagos, Lagos, Nigeria","08055068887, 09041992513",8055068887
872,https://nigeriapropertycentre.com/agents/stevf-homes-properties-27303,Stevf Homes & Properties,,"1, Tanibejilogu Street Iyana Ipaja Alimosho, Lagos State., Iyana Ipaja, Lagos, Nigeria","09057822735, 08104498598, 09057822735",2348025839877
873,https://nigeriapropertycentre.com/agents/almart-properties-limited-297,Almart Properties Limited,almartpropertiesltd@gmail.com,"Block A2-1 Suit 167, Sura Shopping Complex, Simpson Street, Lagos, Nigeria","08171416004, 08085129582, 07061896704",7061896704
874,https://nigeriapropertycentre.com/agents/hot-estate-deals-limited-58820,Hot Estate Deals Limited,hotestatedeals@gmail.com,"4b Bola Crescent Anthony Village Shomolu, Anthony, Lagos State, Nigeria",7088700085,7088700085
875,https://nigeriapropertycentre.com/agents/the-coown-company-99273,The Coown Company,,"3, Amadasun Street, Igbo Efon, Agungi, Lekki, Lagos, Nigeria","+2348038154436, +2348038154436, +2349053546915",2348038154436
876,https://nigeriapropertycentre.com/agents/overall-properties-limited-210409,Overall Properties Limited,,"No. 6 Best Time Avenue, By Ago Bridge, Okota, Lagos, Nigeria",8030724539,8030724539
877,https://nigeriapropertycentre.com/agents/lagos-made-izzy-93707,Lagos Made Izzy,,"No 17 Tobiloba Lawal Street,, Eti Osa, Lagos, Nigeria",9072160018,2349072160018
878,https://nigeriapropertycentre.com/agents/bluehedge-realtors-91,Bluehedge Realtors,info@bluehedgerealtors.com,"Suite 205/232, Block H, Ikota Shopping Complex, Vgc, Lekki, Lagos, Nigeria","+2348177766115, +2348177766112, +2348177766002, +2348177766550",2348177766115
879,https://nigeriapropertycentre.com/agents/cengoss-realtors-89858,Cengoss Realtors,cengossrealtors@gmail.com,"1 Okene Street, Okeira, Ajah, Lagos, Nigeria","08034617858, 08034617858, 08029033567",8034617858
880,https://nigeriapropertycentre.com/agents/ceo-properties-67781,Ceo Properties,ceopropertiesng@gmail.com,"Suit 204, Pearl Plaza 1st Floor, Ajah, Lagos, Nigeria","08137571002, 08035571807",2348137571002
881,https://nigeriapropertycentre.com/agents/hoghen-global-services-limited-9403,Hoghen Global Services Limited,hoghenglobal@gmail.com,"27, Ondo Street, Ebute Metta (east), Lagos, Nigeria","+2347053462323, +2348023163031",2348023163031
882,https://nigeriapropertycentre.com/agents/real-estate-trends-194600,Real Estate Trends,,"House 6 Van Daniels Estate, Orchid Road, Lekki Phase 2, Lagos, Lekki Phase 2, Lagos, Nigeria","08133270255, 08133270255, 08108524863",2348133270255
883,https://nigeriapropertycentre.com/agents/springfield-properties-28369,Springfield Properties,springfieldproperties01@gmail.com,"19, Ladipo Kuku Street, Ikeja, Lagos, Nigeria","08034006578, 08059196727",8034006578
884,https://nigeriapropertycentre.com/agents/realty-in-and-out-consult-54120,Realty In And Out Consult,realtyinandout_consult@yahoo.com,"5, Ogunjobi Oriwu Street, Alapere, Ketu, Lagos, Nigeria","07033410777, 09074085691",2349162306158
885,https://nigeriapropertycentre.com/agents/new-wine-realty-99120,New Wine Realty,sales@newwinerealty.com.ng,"35 Ayodele Okeowo Street,, Gbagada, Lagos, Nigeria","+2348067268043, +2348067268043, 08189861993",2348067268043
886,https://nigeriapropertycentre.com/agents/yemi-adeyanju-company-23172,Yemi Adeyanju & Company,adeyanjuopeyemi@gmail.com,"Block A6 Siute 124, Sura Shopping Complex, Lagos Island, Lagos, Nigeria","08062407696, 08062407696",8062407696
887,https://nigeriapropertycentre.com/agents/daviel-realtors-44208,Daviel Realtors,,"18, Atimi Busari,, Ilogbo Road, Ojo, Lagos, Nigeria","+2348027923903, +2348035745262",2348027923903
888,https://nigeriapropertycentre.com/agents/bonsire-nigeria-limited-153739,Bonsire Nigeria Limited,,"24 Oyindamola Shogbesan Street, Okota, Lagos, Nigeria",9054732059,9054732059
889,https://nigeriapropertycentre.com/agents/marytherealtor-200384,Marytherealtor,,"Block 5, Flat 1, Jakande Estate., Ikorodu, Lagos, Nigeria",8139704124,8139704124
890,https://nigeriapropertycentre.com/agents/ama-integrated-concept-and-multi-services-limited-30902,Ama Integrated Concept And Multi Services Limited,amapropertiesltd@gmail.com,"No 9b St Joseph Street, Osapa London Lekki, Lagos, Nigeria","08035469005, 08028141317",2348028141317
891,https://nigeriapropertycentre.com/agents/ayo-adetunmbi-consulting-32408,Ayo Adetunmbi Consulting,info@ayoadetunmbi.com,"Suite 27a, Block C, Primal Tex Plaza, Iju Road, Agege, Lagos, Nigeria","08097944063, 08038680508",2348038680508
892,https://nigeriapropertycentre.com/agents/biofranproperties-170312,Biofranproperties,,"7 Sunday Oladimeji Close, Command Ipaja Alimosho, Lagos, Nigeria",8141256339,2348141256339
893,https://nigeriapropertycentre.com/agents/uba-anumudu-realty-100076,Uba Anumudu Realty,ubaanumudurealty@gmail.com,"Block B, Unit 2 Southpointe Estate, Lafiaji, Off Lekki - Epe Expressway, Lagos, Nigeria",8134885558,2348134885558
894,https://nigeriapropertycentre.com/agents/emj-legal-and-fiduciary-services-38895,Emj Legal And Fiduciary Services,,"9b, Efunleye Street, Off Talabi Adeniyi Jones, Ogba, Ikeja, Lagos, Nigeria","09097979626, 09097979626",8170910713
895,https://nigeriapropertycentre.com/agents/lilian-integrated-consult-66415,Lilian Integrated Consult,,"E327-e328, Ikota Shopping Complex, Ajah, Lagos State, Nigeria","07030843582, 09134442339",2349134442339
896,https://nigeriapropertycentre.com/agents/jumaded-awoyele-co-27973,Jumaded Awoyele & Co,,"10, Oyinbodudu Street, Nnpc Bus Stop, Ejigbo, Lagos, Nigeria","08169345410, 09161377167, 07040093356",8025320723
897,https://nigeriapropertycentre.com/agents/metd-properties-157868,Metd Properties,,"No. 12, Oyinade Sobowale Close,, Baruwa, Ipaja, Lagos, Nigeria","08105888983, 08105888983",2348105888983
898,https://nigeriapropertycentre.com/agents/core-real-estates-46200,Core Real Estates,corerealestates@gmail.com,"10 Eletu Odibo Abule Oja, Yaba, Lagos, Nigeria","07034501888, 07034501888",7034501888
899,https://nigeriapropertycentre.com/agents/boldridge-limited-62618,Boldridge Limited,boldridgelimited@gmail.com,"Plot 15 Orchids Road By Chevron Tollgate, Lekki, Lagos, Nigeria","08149325498, 08189175511",2348189175511
900,https://nigeriapropertycentre.com/agents/est273-79754,Est.273,topedata@yahoo.com,"18 E, Mac-yoroki Street, Lekki, Lagos, Nigeria","07014921009, 07014921009, 07014921009, 07014921009",2348033360503
901,https://nigeriapropertycentre.com/agents/fobsrealtyltd-204242,Fobsrealtyltd,,"Lekki Lagos, Lagos, Lagos, Nigeria",9010776912,9010776912
902,https://nigeriapropertycentre.com/agents/hamrold-properties-50557,Hamrold Properties,hamroldpptiesltd@yahoo.com,"60 Shyllon Street, Illupeju, Lagos, Nigeria","08027078093, 07030316001",2348027078093
903,https://nigeriapropertycentre.com/agents/marock-resources-enterprises-131571,Marock Resources Enterprises,,"Plot 12, Hunponu Wusu Street (block 58), Ikate, Lekki Phase 1, Lagos, Nigeria","08038479985, 08126664303, 08054265859",2349080888834
904,https://nigeriapropertycentre.com/agents/techvivid-n-fast-global-services-1373,Techvivid N Fast Global Services,techvividglobal_company@yahoo.com,"24, Victoria Arobieke Street, Lekki Phase 1, Lagos, Nigeria",8122278470,2348122278470
905,https://nigeriapropertycentre.com/agents/lfk-ltd-153355,Lfk Ltd,info@lfkinvestment.co.uk,"75b Modupe Young Street, Ajah, Lagos, Nigeria","08135094664, 09016861483, 09157443530",8135094664
906,https://nigeriapropertycentre.com/agents/ahmed-ojikutu-associates-13869,Ahmed Ojikutu & Associates,ahmedojikutuassociates@yahoo.com,"1, Dele Adedayo Street, Ramat, Ogudu Gra, Lagos State, Nigeria","08037222205, 08037222205, 08051647747, 08098525477",2348037222205
907,https://nigeriapropertycentre.com/agents/jabisco-development-company-limited-40186,Jabisco Development Company Limited,,"Hse @ Miracle Avenue, Abijo, Lagos, Nigeria","08060278440, 08060278440, 08054413136",2348060278440
908,https://nigeriapropertycentre.com/agents/quolar-global-services-28812,Quolar Global Services,quolarglobalservices@yahoo.com,"Suite A07, Eleganza Shopping Mall, Opp. Ikota Shopping Complex, Lekki - Epe Express Way, Lagos, Nigeria","+2348052444369, +2348122986390, +2348062855738",2348052444369
909,https://nigeriapropertycentre.com/agents/realtypros-investment-global-limited-154494,Realtypros Investment Global Limited.,,"House 7,200 Road, Festac Town, Lagos, Nigeria","08065227481, 07016587374",23408065227481
910,https://nigeriapropertycentre.com/agents/matt-gardens-123089,Matt Gardens,onojetahharrison@gmail.com,"9 Makinde Street, Off Awolowo Way, Ikeja, Lagos, Nigeria","+2349025888791, 07044814947",2349025888791
911,https://nigeriapropertycentre.com/agents/siaca-royalle-ltd-178238,Siaca Royalle Ltd,,"17b Robert Nebolisa Agungi, Lekki, Lagos, Nigeria","+2347025004779, +2347025004779",2347025004779
912,https://nigeriapropertycentre.com/agents/de-beatech-nigeria-limited-30845,De-beatech Nigeria Limited,,"8, Sylva Street, Badore, Eti Osa, Ajah, Lagos, Nigeria","08033673090, 09113660101, 07067375088",2348033673090
913,https://nigeriapropertycentre.com/agents/mo-global-ventures-88743,Mo Global Ventures,mo.globalventures@gmail.com,"7b Rafiu Adebayo Street, Ibeju Lekki, Lagos, Nigeria","+2348062345097, +2347088387174, +2347088387174",2347088387174
914,https://nigeriapropertycentre.com/agents/posh-properties-5536,Posh Properties,,"27, Obafemi Awolowo Way, Ikeja, Lagos, Nigeria","08036176437, 08023933093",8036176437
915,https://nigeriapropertycentre.com/agents/nobity-limited-67909,Nobity Limited,nobityproperties@gmail.com,"15 Oshola Street, Ogba Ikeja, Lagos, Nigeria","08036169280, 08130988889, 08085007776, 08098222360",2348036169280
916,https://nigeriapropertycentre.com/agents/cletus-agadi-and-company-31081,Cletus Agadi And Company,agadiclet@yahoo.com,"37, Ondo Street, Oke-ira Ogba,, Ikeja, Lagos, Nigeria","08053968052, 08036863670, 08051106711, 08125196992",2348036863670
917,https://nigeriapropertycentre.com/agents/zikan-realtors-limited-97912,Zikan Realtors Limited,,"4 Ugo Nnabuife Street Ajao Estate, Isolo Oshodi, Lagos, Nigeria","08026680738, 09056926363, 09056926363",2348026680738
918,https://nigeriapropertycentre.com/agents/xpress-homes-115187,Xpress Homes,shoneyesther@gmail.com,"4, Oyebanji Close, Ologolo Town Short Let Agency., Agungi, Lagos, Nigeria",9016913735,2349016913735
919,https://nigeriapropertycentre.com/agents/landon-properties-and-homes-101336,Landon Properties And Homes,,"7, Modinatu Obaremi Street, Off Adeshina Okeira Ogba., Ikeja, Lagos State, Nigeria",9046093639,2348131053067
920,https://nigeriapropertycentre.com/agents/david-million-ideas-housing-85276,David Million Ideas Housing,,"5 Thomas Street, Ajah, Lagos, Nigeria","07039368345, 08063690695",8063690695
921,https://nigeriapropertycentre.com/agents/freddy-homes-ltd-179054,Freddy Homes Ltd,,"Block F4, Suit 45, Hfp Eastline Shopping Complex, Abraham Adesanya Roundabout, Ajah, Lagos, Nigeria",8115104184,8115104184
922,https://nigeriapropertycentre.com/agents/donchris-homes-79206,Donchris Homes,,"17/19 Old Olowora Road, Isheri, Ojodu Berger, Lagos, Nigeria","08022122282, 09066438423",2348022122282
