id,profile_url,name,email,address,phone,whatsapp
460,https://nigeriapropertycentre.com/agents/vandez-global-ventures-ltd-11746,Vandez Global Ventures Ltd,info@vandez.com.ng,"10, Baale Street, Agungi, Lekki, Lagos, Nigeria","+2348037501514, +2348037501514, 08052482357",2348037501514
461,https://nigeriapropertycentre.com/agents/biodun-olapade-co-11611,Biodun Olapade & Co.,opeyemi.o@biodunolapade.com,"Obafemi Awolowo House, 29/31, Obafemi Awolowo Way, Ikeja, Lagos, Nigeria",8062397702,2348062397702
462,https://nigeriapropertycentre.com/agents/alhicon-global-invest-ltd-37566,Alhicon Global Invest Ltd,alhicom@yahoo.com,"Suite 42, Alesh Shopping Complex, Temidire Mkt Annex,, Ajah, Lagos, Nigeria","08038353982, 08024222394",8024222394
463,https://nigeriapropertycentre.com/agents/hitee-homes-61757,Hitee Homes,,"39, Omo Ighodalo Street, Ogudu Gra, Lagos, Nigeria","+2347083111902, 07060877092",2347060877092
464,https://nigeriapropertycentre.com/agents/gloria-ogbebor-associates-32822,Gloria Ogbebor & Associates,gloriaogbeborandassociates@yahoo.com,"Block B, Suite 299, Sura Shopping Complex, Simpson Street, Lagos Island, State, Nigeria","08023188472, 08099903371",2348099903371
465,https://nigeriapropertycentre.com/agents/onyebuchi-ukandu-co-2971,Onyebuchi Ukandu & Co.,ifeanyiogbuka@gmail.com,"55 Ijikoyejo Street, Ijesha, Surulere, Lagos, Nigeria","08033270663, 08052358595",2348033270663
466,https://nigeriapropertycentre.com/agents/eutemia-properties-122937,Eutemia Properties,eutemiaproperties@yahoo.com,"42 Muritala Eletu Way, Osapa London, Lagos, Nigeria","+2348117175407, +2348081492927",2348081492927
467,https://nigeriapropertycentre.com/agents/flocisco-global-resources-ltd-34848,Flocisco Global Resources Ltd,,"5, Meji Ogbe Street, Eyinta, Ikorodu, Lagos, Nigeria","09137434127, 08071637815",9137434127
468,https://nigeriapropertycentre.com/agents/je-srael-integrated-limited-33385,Je-srael Integrated Limited,seunest01@gmail.com,"No 40, Lumina Foundation Avenue, Destiny Homes Estate, Ajah, Lagos, Nigeria","08032130990, 09053849474, 08023614823, 07066379696",8032130990
469,https://nigeriapropertycentre.com/agents/olalekan-aboderin-consulting-27045,Olalekan Aboderin Consulting,oacvaluers@gmail.com,"13, Emina Crescent, Off Toyin Street, Ikeja, Lagos, Nigeria","07030942282, 08165893529, 08082179121, 08099917100",8065058032
470,https://nigeriapropertycentre.com/agents/chiuzo-properties-limited-198602,Chiuzo Properties Limited,,"198 Olarewaju Street, Fidiso Estate, Ibeju Lekki, Lagos, Nigeria","08132874237, 08132874237, 08132874237",8132874237
471,https://nigeriapropertycentre.com/agents/ticino-group-29371,Ticino Group,ticinogroup@yahoo.com,"17, Oritola Drive , Abijoh, Lagos, Nigeria","08138504813, 08111465180",8138504813
472,https://nigeriapropertycentre.com/agents/mcsay-homes-110052,Mcsay Homes,kofo.adewumi@gmail.com,"Providence Street, Lekki Phase 1, Lagos, Nigeria",7067543841,7067543841
473,https://nigeriapropertycentre.com/agents/glore-restoree-ltd-101972,Glore Restore'e Ltd,tolulopeogundairo32@gmail.com,"11 Bankole Street, Shomolu, Lagos, Nigeria","+2348023333668, +2348068298423",2348023333668
474,https://nigeriapropertycentre.com/agents/lanre-odunayo-co-65462,Lanre Odunayo & Co.,lanruzeey@yahoo.com,"3, Barrister Iwugo Street, Victory Estate, Iba, Ojo, Lagos State, Nigeria","08024307958, 08024307958, 08060858683, 09096458088",2348024307958
475,https://nigeriapropertycentre.com/agents/sabrina-properties-ltd-36318,Sabrina Properties Ltd,sabrina.properties@yahoo.com,"Sabrina Building, Plot 5a, Block A10, Admiralty Way, Lekki Phase 1, Lekki, Lagos, Nigeria","08053696309, 08053696307, 08053696317",8053696311
476,https://nigeriapropertycentre.com/agents/findville-realty-ltd-88065,Findville Realty Ltd,info@findvillerealty.com,"17 Alafia Street Off Nelson Cole, Iju Road Abule Egba, Ifako Ijaye, Lagos, Nigeria","09130000005, 09130000004, 08037728675",9130000004
477,https://nigeriapropertycentre.com/agents/maykol-integrated-services-30514,Maykol Integrated Services,maykolhomes@gmail.com,"32a Araromi Street, Onipan, Lagos State, Nigeria","08167114877, 08021464414",8167114877
478,https://nigeriapropertycentre.com/agents/kma-property-management-limited-39652,,,,,
479,https://nigeriapropertycentre.com/agents/enville-estates-ltd-122712,Enville Estates Ltd,info@envilleestatesltd.com,"13 Osama Street, Imalete Alafia Town, Ibeju Lekki, Lagos, Nigeria",8136036582,2348136036582
480,https://nigeriapropertycentre.com/agents/grace-property-ikorodu-mighty-grace-investment-property-co-ltd-903,Grace Property Ikorodu ( Mighty Grace Investment & Property Co. Ltd ),gracepropertyikorodu@gmail.com,"63, Ayangbure Road, Ikorodu, Lagos, Nigeria","08023201467, 2348136348745, 2348136348745, +2348136348745",2348023201464
481,https://nigeriapropertycentre.com/agents/firstglobal-business-ltd-122894,Firstglobal Business Ltd,,"27, Raji Oba Street, Alimosho Lga, Lagos, Nigeria",8063176701,8063176701
482,https://nigeriapropertycentre.com/agents/david-moren-property-services-40699,David Moren Property Services,,"3 Macgregor Road, Keffi, Ikoyi, Lagos, Nigeria",7035839412,2347035839412
483,https://nigeriapropertycentre.com/agents/don-zikky-global-services-20945,Don-zikky Global Services,,"Block C Suite 38 By Iyana Ejigbo Shopping Complex Along Ejigbo Ikotun Rd By Iyana Ejigbo B.stop, Ejigbo, Lagos, Nigeria","08023920554, 08147047796",8023920554
484,https://nigeriapropertycentre.com/agents/heightview-homes-139902,Heightview Homes,,"22b, Olaniyi Street, Off Pedro Road, Shomolu, Lagos State, Nigeria","+2347031066034, +2348077777199",2348077777199
485,https://nigeriapropertycentre.com/agents/adequateassociate-unlimited-22727,Adequateassociate Unlimited,adequateassociate1@gmail.com,"1, Ilaje Street, Eti Osa, Ajah, Lagos, Nigeria","08099885781, 08037423400, 08064402183, 08052957449",2348099885781
486,https://nigeriapropertycentre.com/agents/gtext-and-associates-limited-145189,Gtext And Associates Limited,,"25a Lola Holloway Omole Phase 1, Ikeja, Lagos, Nigeria",2348104173221,2348104173221
487,https://nigeriapropertycentre.com/agents/iconview-de-luxe-ltd-117467,Iconview De-luxe Ltd,,"10/12 Agboola Gomez Street, Abijo, Lagos, Nigeria",7066145523,
488,https://nigeriapropertycentre.com/agents/joii-heights-concepts-61547,Joii Heights Concepts,,"2 Bubble Close, Alagbole, Akute, Lagos, Nigiera","07081143654, 07035143376",2347081143654
489,https://nigeriapropertycentre.com/agents/hs-interactive-ltd-1075,Hs Interactive Ltd,okhiriaitua1@gmail.com,"11a, Dapo Awolasi Street, Magodo G.r.a Phase 2, Shangisha, Lagos, Nigeria","07034727021, 08059320415",7034727021
490,https://nigeriapropertycentre.com/agents/mapida-homes-86443,Mapida Homes,paul@mapidahomes.com,"1a, Peony Avenue Ikota Gra, Lekki, Lagos, Nigeria","07068359300, 08092728022",2347068359300
491,https://nigeriapropertycentre.com/agents/wallnorth-consult-30040,Wallnorth Consult,,"No. 1, Gideon Odumah Street, Peaceland Estate, Ogombo, Ajah, Lagos, Nigeria","08098509888, 08030737677",2348030737677
492,https://nigeriapropertycentre.com/agents/budget-experts-101937,Budget Experts,,"10, Abah Way, Mende, Maryland, Lagos, Nigeria","08080366131, 08050320400",2348050320400
493,https://nigeriapropertycentre.com/agents/seyi-ekanem-co-20315,Seyi Ekanem & Co,seyiekanemandco@gmail.com,"1, Austin Coker Drive, Harmony Estate, Ogba, Ikeja, Lagos","08137141504, 08057706099",8057706099
494,https://nigeriapropertycentre.com/agents/touchstone-haven-realty-limited-72159,Touchstone Haven Realty Limited,touchstonehaven@gmail.com,"Aro Oluwasegun Street 3 Atlantic Estate Phase Two, Oribanwa, Lagos, Nigeria","08163219470, 08152099940",8152099940
495,https://nigeriapropertycentre.com/agents/joan-realty-20117,Joan Realty,joanrealtors@gmail.com,"Suit 1 Elegant Shopping Mall, Mobil Road, Lekki Expressway, Ajah Lekki, Lagos, Nigeria","07088394040, 08072016717, 08088670165",8072016717
496,https://nigeriapropertycentre.com/agents/crovation-limited-34306,Crovation Limited,,"Plot 8b, Ibezim Obiajulu, Masha, Surulere, Lagos, Nigeria",7039226807,2347039226807
497,https://nigeriapropertycentre.com/agents/spartan-planet-30256,Spartan Planet,,"1 Bale Street, Igbo-efon Bus Stop,, Lekki, Lagos, Nigeria",8122254648,8122254648
498,https://nigeriapropertycentre.com/agents/homephase-realty-150031,Homephase Realty,,"4 Seriki Street Off Odunsi Road Bariga, Somolu, Lagos, Nigeria",9053146304,9053146304
499,https://nigeriapropertycentre.com/agents/borhloch-techniker-company-ltd-82133,Borhloch Techniker Company Ltd,info@borhlochtech.com,"19 Ojodu- Abiodun Rd, Berger B/stop, Ikeja, Lagos, Nigeria","08104718027, 08025167759",8104718027
500,https://nigeriapropertycentre.com/agents/belvin-gold-limited-195786,Belvin Gold Limited,,"Suite J183 Road 5 Ikota Shopping Complex, Vgc, Lekki, Lagos, Nigeria","08070750483, 09025847180",2348070750483
501,https://nigeriapropertycentre.com/agents/foresight-facility-managers-17460,Foresight Facility Managers,,"9, Okunneye Avenue, Pedro, Shomolu, Bariga, Lagos, Nigeria","08165381808, 08123778920",2348165381808
502,https://nigeriapropertycentre.com/agents/beyourlandlord-realty-86757,Beyourlandlord Realty,info@beyourlandlord.ng,"43 Otunba Street, Ojodu Berger, Lagos, Nigeria",8062876756,2348062876756
503,https://nigeriapropertycentre.com/agents/divine-access-homes-a-subsidiary-of-divine-access-investments-intl-limited-75362,Divine Access Homes ( A Subsidiary Of Divine Access Investments Int'l Limited),divine.accessinvest@gmail.com,"8, Nwankwo Ibusa Drive, Addo Okeira, Lekki, Lagos, Nigeria","+2347011406853, +2348135588667, +2348110227156, +234802882853",2347011406853
504,https://nigeriapropertycentre.com/agents/gugo-realty-104647,Gugo Realty,,"1 Onyebuchi Street Ago Bridge, Okota, Lagos, Nigeria","09025998028, 09025998028",2349025998028
505,https://nigeriapropertycentre.com/agents/lekki-luxury-homes-lifestyle-58033,Lekki Luxury Homes & Lifestyle,,"Level 5, Dominion Plaza, Igbo Efon, Lekki, Lagos, Nigeria","07082621178, 08092220647",2347082621178
506,https://nigeriapropertycentre.com/agents/pet-bamok-company-15274,Pet Bamok & Company,pettbamok@gmail.com,"6 Olabisi Adewunmi Street, Ajah, Lekki, Lagos, Nigeria",8098762777,2348098762777
507,https://nigeriapropertycentre.com/agents/inside-out-properties-ltd-48971,Inside Out Properties Ltd,insideout1.ogg@gmail.com,"22, Olanrewaju Olalere Lane, Abijoh, Lekki, Lagos State, Nigeria","09044392126, 08156294383",2348156294383
508,https://nigeriapropertycentre.com/agents/truebond-properties-and-leisure-limited-185378,Truebond Properties And Leisure Limited,,"Plot 22, Akinogun Road, New Market, Oniru, Victoria Island, Lagos, Nigeria","+2349071234035, +2349071234035, +2348135724403",2349071234035
509,https://nigeriapropertycentre.com/agents/havencrestproperties-127557,Havencrestproperties,,"Forthright Garden, Ifo, Lagos, Nigeria",8144237717,2348144237717
510,https://nigeriapropertycentre.com/agents/parexis-resources-64689,Parexis Resources,,"57, Oluyombo Street, Ikosi, Ketu, Lagos, Nigeria","08165080814, 08088881391",2348165080814
511,https://nigeriapropertycentre.com/agents/jutomex-properties-limited-47328,Jutomex Properties Limited,,"4 Seidu Ajibowu Street, Alade, Ikeja, Lagos, Nigeria",2348033017027,2348033017027
512,https://nigeriapropertycentre.com/agents/westee-limited-46784,Westee Limited,,"No 1/3, Shittu Saka Musa Street (block B, Flat 3), Alagunta, Off Mobil Road, Ilaje, Lekki-ajah, Lagos, Nigeria","08164487456, 08164487456, 09053004918",2348164487456
513,https://nigeriapropertycentre.com/agents/swift-heritage-real-estate-limited-20969,Swift Heritage Real Estate Limited,info.shrel@gmail.com,"Suite 45 Dimak Plaza By Orelope Bus Stop, Egbeda, Lagos ., Nigeria","07060603696, 08086693381, 07060603696, 08086693381",2347060603696
514,https://nigeriapropertycentre.com/agents/house-of-abby-realtors-and-apartments-118313,House Of Abby Realtors And Apartments,,"No 6 Hakeem Alobo Bakare Close, Langbasa, Lagos, Lagos, Nigeria","08114397078, 08113869665",2348113869665
515,https://nigeriapropertycentre.com/agents/gentsky-marketing-enterprises-50141,Gentsky Marketing Enterprises,gentskyproperties@gmail.com,"32a, Mike Adegbite Street, Ikate, Lekki, Lagos, Nigeria","07053919969, 07068011924",2347053919969
516,https://nigeriapropertycentre.com/agents/squarefeet-135093,Squarefeet,,"House 1 Pelleh Homes, Off Lekki Palm City Estate, Ajah, Lagos, Nigeria","09038498052, +447867757016",2349038498052
517,https://nigeriapropertycentre.com/agents/ib-d-tech-solutions-limited-38317,Ib & D Tech Solutions Limited,,"Road 3 Extension, Wellstock House 1, Ikota, Lekki, Lagos, Nigeria",2347025005616,2347025005616
518,https://nigeriapropertycentre.com/agents/m-surge-ventures-49260,M-SURGE VENTURES,msurgeventuresnigltd@gmail.com,"15, Bayo Kuku, Ikoyi, Lagos, Nigeria","2349076788050, 2349076788050",2349076788050
519,https://nigeriapropertycentre.com/agents/earthforia-property-limited-159491,Earthforia Property Limited,,"32, Emmanuel Emagui Street, Olive Park Estate Ibeju, Lekki, Lagos, Nigeria","08030412002, 08160535228, 08062387996",2348030412002
520,https://nigeriapropertycentre.com/agents/boulevard-global-consulting-limited-126994,Boulevard Global Consulting Limited,,"Suite E106, Road 3, Opp Union Bank, Ikota Shopping Complex, Ajah, Lagos, Nigeria","08064416883, 08143399639",2348064416883
521,https://nigeriapropertycentre.com/agents/mcnexus-realty-209453,Mcnexus Realty,,"10 Adetokunbo Onaleye, Lekki, Lagos, Nigeria","07062741302, 08058528408",2347062741302
522,https://nigeriapropertycentre.com/agents/ribourne-enterprises-27663,Ribourne Enterprises,seunawe@yahoo.com,"18a, Olayinka Balogun Crescent, Shangisha, Magodo, Lagos, Nigeria","08032188209, 08032188209, 08032188209",2348032188209
523,https://nigeriapropertycentre.com/agents/rose-mont-development-limited-157123,Rose-mont Development Limited,gbemi@mintsgroup.net,"3, Ajele Street, St Peter House, 6th Floor,, Lagos Island, Lagos, Nigeria","08094446555, 08146668888, 07087972885, 08061514548",2348094446555
524,https://nigeriapropertycentre.com/agents/yeans-heritage-co-85675,Yeans Heritage & Co,,"Fff Rd 14 Onike, Yaba,, Lagos., Nigeria.","08032971646, 08071383835",2348032971646
525,https://nigeriapropertycentre.com/agents/enokfem-nigeria-limited-167669,Enokfem Nigeria Limited,femiokedairo@gmail.com,"53, Ijaye Road, Ogba, Ikeja, Lagos, Nigeria","08060346428, 08052951513, 09135562898",8060346428
526,https://nigeriapropertycentre.com/agents/dewhaven-multiconcepts-limited-15071,Dewhaven Multiconcepts Limited,obafemi@dehavenmulticonceptslimited.org,"Plot 334, Adeyemo Akapo Street, Omole Phase 1, Ojodu, Ikeja, Lagos, Nigeria","+2348037255643, 08026988209",2348037255643
527,https://nigeriapropertycentre.com/agents/ammore-integrated-services-ltd-32480,Ammore Integrated Services Ltd,ammoresales@gmail.com,"Hse 6 Moses Ebitu Street, Ologolo, Agungi, Lekki, Lagos, Nigeria",8118484045,9013830399
528,https://nigeriapropertycentre.com/agents/4-tee-properties-investment-ltd-460,4-tee Properties & Investment Ltd,4teeproperty@gmail.com,"Suite C 193, Ikota Shopping Complex, V.g.c, Ajah, Lagos, Nigeria","08138626902, 07083675988",2348138626902
529,https://nigeriapropertycentre.com/agents/astute-realtors-1312,Astute Realtors,astuterealtorslimited@gmail.com,"House 188, Oniru Resettlement Scheme Estate, Victoria Island, Lagos, Nigeria","08028273500, 08172118637",2348028273500
530,https://nigeriapropertycentre.com/agents/e-t-nelson-enterprises-24383,E. T. Nelson Enterprises,surveyetnelson@gmail.com,"No.6, Demola Akande Street, Ajah, Lagos, Nigeria",7049156172,8138382890
531,https://nigeriapropertycentre.com/agents/house-davanni-realty-ltd-103647,House Davanni Realty Ltd,,"Block 8, Flat 6, Adeniji Adele, Dolphin Estate, Phase 1, Lagos Island, Nigerian, Lagos, Nigeria","08051280014, 08170026396",2348051280014
532,https://nigeriapropertycentre.com/agents/cw-real-estate-95477,CW Real Estate,listings@cwlagos.com,"No 1 Towry Close, Idejo Street, Off Adeola Odeku, Victoria Island, Lagos, Nigeria","+2349062511340, +2349062511340",2349062511340
533,https://nigeriapropertycentre.com/agents/paul-ikenna-partners-25776,Paul Ikenna & Partners,uikennapaul@gmail.com,"19, Ogo-oluwa Street, Modupe, Ogba, Ikeja, Lagos, Nigeria","08035494141, 08035494141, 09135651543",2348035494141
534,https://nigeriapropertycentre.com/agents/trident-realty-30704,Trident Realty,tridentrealty40@gmail.com,"109, Awolowo Road , Ikoyi, Lagos, Nigeria","08038485456, 08096498780",2348038485456
535,https://nigeriapropertycentre.com/agents/horlan-homes-74512,,,,,
536,https://nigeriapropertycentre.com/agents/piedras-properties-and-investment-limited-141399,Piedras Properties And Investment Limited,linuschukwudi1982@gmail.com,"Iju Road, Plot 65 Iju-agege Road, Lagos, Nigeria","07013015454, 09153096947",7013015454
537,https://nigeriapropertycentre.com/agents/daramola-gabriel-company-estate-surveyors-valuers-73724,Daramola Gabriel & Company (estate Surveyors & Valuers),gabrieldaramola120@yahoo.com,"Plot 22, Oba Lateef Adams Estate,, Iloro-agege, Lagos, Nigeria",2347035031826,2347089891313
538,https://nigeriapropertycentre.com/agents/sabega-environconcept-4476,Sabega Environconcept,sabegaconcept@yahoo.com,"5, Adebisi Oyenola Street, Idado Town, Lekki, Lagos, Nigeria","08034457307, 08188005995, 08020557125",8034457307
539,https://nigeriapropertycentre.com/agents/mc-realtors-company-84302,Mc Realtors Company,,"B Close, 722 Road, Festac Town, Lagos, Nigeria",8022410586,8022410586
540,https://nigeriapropertycentre.com/agents/blithe-real-estate-76932,Blithe Real Estate,,"19 Folawewo Street, Ikeja, Lagos, Nigeria","08035230368, 08092277818",8092277818
541,https://nigeriapropertycentre.com/agents/micon-homes-and-interiors-64884,Micon Homes And Interiors,miconhomesandinteriors@gmail.com,"10 Fola Ojikutu, Street, Off Agoh Palace Way, Okota, Oshodi Lagos, Lagos, Nigeria, Lagos, Nigeria","09035034844, 08129579253",9035034844
542,https://nigeriapropertycentre.com/agents/faz-realtors-44735,Faz Realtors,fazrealtorsf@gmail.com,"3, Yemi Suara Street, Ibeju, Lagos State, Nigeria","08035047639, 07042806406, 07046477318, 07046055461",2348035047639
543,https://nigeriapropertycentre.com/agents/kland-realtors-6694,Kland Realtors,klandrealtor@gmail.com,"10, Olusesi Street, Ire Akari Estate, Isolo, Lagos, Nigeria","08028836825, 08167866011",2348028836825
544,https://nigeriapropertycentre.com/agents/tot-property-partner-ltd-1775,Tot Property Partner Ltd,totpropertypartner@gmail.com,"No 38, Akintan Street, Dideolu Estate, Off Ijaiye Road, Ogba, Lagos, Nigeria","08032809296, 08032809296, 08032809296, 09020139480",8032809296
545,https://nigeriapropertycentre.com/agents/otun-reigns-global-enterprises-113801,Otun Reigns Global Enterprises,otunreignsinternational@yahoo.com,"6,akinde Street, Iyana Ipaja, Lagos, Nigeria",8130481668,8130481668
546,https://nigeriapropertycentre.com/agents/brokerlease-properties-and-real-estate-26215,Brokerlease Properties And Real Estate,,"14, Biodun Bada Street, Egan, Lagos, Nigeria","08084833523, 08118058173",8084833523
547,https://nigeriapropertycentre.com/agents/aso-palace-limited-6361,Aso Palace Limited,aderemiojolowo@gmail.com,"22 Moshood Opere Street, Lagbansa Road Unity Layout Estate Owode, Ajah, Lagos, Nigeria","07054583588, 08132483026, 07019466126",8132483026
548,https://nigeriapropertycentre.com/agents/first-meridian-property-company-55481,First Meridian Property Company,firstmeridianproperties@gmail.com,"6, Alh. Toyibat Street, Medina Estate, Gbagada, Lagos, Nigeria",9058431058,2349058431058
549,https://nigeriapropertycentre.com/agents/innerworkings-investments-ltd-24339,Innerworkings Investments Ltd,innerworkings_investmentsltd@yahoo.com,"Close 50, House F 25, Vgc, Lekki, Lagos, Nigeria","08063531327, 08063531327, 07087503481",2348063531327
550,https://nigeriapropertycentre.com/agents/ait-real-estate-consult-60702,A.i.t. Real Estate Consult,aitrealco@yahoo.com,"Lagos, Suite 4, Jonwo Plaza, Ilupeju Road, Ilupeju, Lagos, Nigeria","08035426255, 09096697331, 08085840767, 08153039792",2348085840767
551,https://nigeriapropertycentre.com/agents/daibol-property-solutions-150354,Daibol Property Solutions,daibolpropertysolutions@gmail.com,"2, Dele Osuntunyi Street, Golden Estate, Kekere, Addo Road, Ajah, Lagos State, Nigeria","07062402446, 08150210026",2347062402446
552,https://nigeriapropertycentre.com/agents/luli-homes-and-shortlet-limited-200355,Luli Homes And Shortlet Limited,,"7, Abike Ogidi Close, Ikorodu, Lagos, Nigeria",8147283624,2348147283624
553,https://nigeriapropertycentre.com/agents/temimatt-global-services-limited-67958,Temimatt Global Services Limited,temimattglobalserviceslimited@gmail.com,"Plot 108 Block 245 Flat 6 Zone D2 Iba Housing Estate, Ojo, Lagos, Nigeria","08027319415, 08038326958",2348027319415
554,https://nigeriapropertycentre.com/agents/leke-adeniji-consulting-57962,Leke Adeniji Consulting,info@lekeadenijiconsulting.com,"26, Oduyemi Street, Anifowoshe, Off Obafemi Awolowo Way, Ikeja, Lagos, Nigeria","012957527, 08034542221, 08026403494",2348034542221
555,https://nigeriapropertycentre.com/agents/landuna-homes-27510,Landuna Homes,landunahomes@gmail.com,"2, Pat Obadjare Street, Okeira, Lagos, Nigeria","07039458090, 07039458090, 08125649245",7039458090
556,https://nigeriapropertycentre.com/agents/rouxey-vision-limited-13408,Rouxey Vision Limited,,"Km 44 Lekki Epe Expressway, Sangotedo, Lagos, Nigeria","+2348161813556, +2348161813556, +",2348161813556
557,https://nigeriapropertycentre.com/agents/silverbell-premium-properties-68979,Silverbell Premium Properties,,"22, Isaac Aluko Olokun Street, Igbo-efon, Lekki, Lagos, Nigeria","07067967943, 08129315987",2347067967943
558,https://nigeriapropertycentre.com/agents/ttfaim-properties-33133,Ttfaim Properties,ttfaimproperties@gmail.com,"1, Adegbenro St. Off Yetunde Brown Road. Ifako, Gbagada, Lagos, Nigeria","08052428976, 08093630354",2348093630354
559,https://nigeriapropertycentre.com/agents/diamond-stones-homes-ltd-174103,Diamond Stones Homes Ltd,diamondstoneshomes@gmail.com,"11 Gbara Saviour, Street, Agungi, Lagos, Nigeria",8083731029,8083731029
560,https://nigeriapropertycentre.com/agents/primavera-property-investment-company-28016,Primavera Property & Investment Company,,"69 Kusenla Road, Surulere, Lagos, Nigeria","08150990954, 08150990954, 07047162201",8150990954
561,https://nigeriapropertycentre.com/agents/eccentric-agency-126194,Eccentric Agency,,"16 Irepodun Street, Akiode Ojodu, Ojodu Berger, Lagos, Nigeria","09037964228, 07052120510",9037964228
562,https://nigeriapropertycentre.com/agents/zeema-homes-32094,Zeema Homes,zeemahomes@gmail.com,"100, Olojo Drive, Ojo, Lagos, Nigeria","08035204747, 07054444781",2348035204747
563,https://nigeriapropertycentre.com/agents/17-three-digital-realtors-33158,17 Three Digital Realtors,17threedigitalrealtors@gmail.com,"No 14b, Kasumu Street, Shangisha, Kosofe, Magodo, Lagos, Nigeria",8068958046,2349067442944
564,https://nigeriapropertycentre.com/agents/c-w-real-estate-31111,C W Real Estate,hello@cwlagos.com,"No 1, Towry Close, Idejo Street, Off Adeola Odeku., Victoria Island, Lagos, Nigeria","+2347048089358, 09062511345, 07048089359",7048089358
565,https://nigeriapropertycentre.com/agents/franklin-obiadi-juls-luxuryhomes-116024,Franklin Obiadi Juls Luxuryhomes,juls.luxuryhomes@gmail.com,"15, Bassey Street,, Egbeda, Lagos, Nigeria","08137133596, 08028455619",8028455619
566,https://nigeriapropertycentre.com/agents/rexbamok-consulting-33413,Rexbamok Consulting,rexbamok@gmail.com,"21, Taike Street, Ikosi, Ketu, Lagos, Nigeria","07051018777, 07051018777",2347051018777
567,https://nigeriapropertycentre.com/agents/andysean-global-concept-ltd-101294,Andysean Global Concept Ltd,heifersylvia@gmail.com,"4 Remi Folorunsho Lane, Ajao Estate, Mende, Ikeja, Lagos, Nigeria","07044903566, 07068085367, 08161142878",2347044903566
568,https://nigeriapropertycentre.com/agents/p-debo-enterprises-28610,P-debo Enterprises,debowaled@gmail.com,"No 6, D E Street Shagari Estate, Ipaja, Lagos, Nigeria",8032295679,2348032295679
569,https://nigeriapropertycentre.com/agents/riyadh-realtors-50718,Riyadh Realtors,,"27, Idimu Road, Opp Alg Secretariat, Ikotun, Lagos, Nigeria","09050170123, 08080543117",2349050170123
570,https://nigeriapropertycentre.com/agents/locatediscount-listing-142939,Locatediscount Listing,,"No 2 Eddie Elejie Street, Agungi, Lekki, Lagos, Nigeria",9059476544,9059476544
571,https://nigeriapropertycentre.com/agents/lagos-realty-limited-209835,Lagos Realty Limited,,"5a, Alhaji Alade Odunewu, Parkview Estate, Ikoyi, Lagos, Nigeria","+2349064964355, 09038960674",2349064964355
572,https://nigeriapropertycentre.com/agents/3z-limited-64520,3z Limited,donbarns@hotmail.com,"Plot 29, Fatai Olusesi, Ikota, Lagos, Lagos, Nigeria","+2347088802212, +2347059718675",2347059718675
573,https://nigeriapropertycentre.com/agents/alliance-real-estate-development-181335,Alliance Real Estate Development,,"7 Yinusa Adeniji Street Allen, Ikeja, Lagos, Nigeria","+2348112602691, +2348112602691",2348112602691
574,https://nigeriapropertycentre.com/agents/chrisp-ventures-limited-17682,Chrisp Ventures Limited,chrispventureslimited@gmail.com,"82, Kudirat Abiola Way, Oregun, Ikeja, Lagos, Nigeria","08101829037, 08059704190",9097926817
575,https://nigeriapropertycentre.com/agents/margins-scribe-ventures-limited-131379,Margins Scribe Ventures Limited,,"26 Akin Leigh Crescent, Lekki, Lagos, Nigeria","+23413438989, 08181885500, 07061640329",
576,https://nigeriapropertycentre.com/agents/grabesg-international-41207,Grabesg International,grabesg@yahoo.com,"3, Bayo Ajayi Street, Off Hakeem Balogun, Adjacent African Shrine, Cbd, Agidingbi, Ikeja, Lagos, Nigeria","08024533815, 09084474272",2348024533815
577,https://nigeriapropertycentre.com/agents/lisieux-avila-properties-limited-45117,Lisieux Avila Properties Limited,lisieuxavila@gmail.com,"154 Herbert Macaulay Way, Ebute Metta, Lagos, Nigeria","09042852943, 09042852943, 07055030235, +2349042852943",9042852943
